[
  {
    "test_case_id": "TC-TRK-0001",
    "title": "Verify checklist step saves successfully with valid data",
    "description": "Ensures the save endpoint returns success when all required fields are provided.",
    "module": "Orders",
    "test_type": "functional",
    "priority": "high",
    "preconditions": [
      "User is logged in with QA role",
      "User is on the Checklist Step page"
    ],
    "manual_steps": [
      {
        "step_number": 1,
        "action": "Fill all required fields and click Save",
        "expected_result": "Form saves successfully. Success message is shown.",
        "notes": ""
      },
      {
        "step_number": 2,
        "action": "Refresh the page and verify data persists",
        "expected_result": "Saved data is still visible with correct values.",
        "notes": ""
      }
    ],
    "automation_steps": [
      {
        "step_number": 1,
        "playwright_action": "click",
        "selector_key": "TODO_save_button",
        "value": "",
        "assertion_type": "visible",
        "assertion_value": ""
      },
      {
        "step_number": 2,
        "playwright_action": "navigate",
        "selector_key": "TODO_checklist_url",
        "value": "/Orders/OrderItem/View",
        "assertion_type": "url",
        "assertion_value": "/OrderItem/View"
      }
    ],
    "test_data": {
      "stepId": 1
    },
    "confidence_score": 7,
    "needs_review": false,
    "review_note": "",
    "generated_from_file": "WebApp/Areas/Orders/Controllers/OrderItemController.cs",
    "generated_at": "2025-03-20T10:00:00Z"
  }
]