[
  {
    "test_case_id": "TC-TRK-0001",
    "title": "Verify error message generation for permission error in checklist step save",
    "description": "Ensures that when a TrackerResult contains a permission error, the GenerateQuestionSavingErrorMessage method returns the appropriate localized error message.",
    "module": "Orders",
    "test_type": "functional",
    "priority": "high",
    "preconditions": [
      "User is logged in",
      "User is on a checklist step page",
      "User has limited permissions for the checklist step"
    ],
    "manual_steps": [
      {
        "step_number": 1,
        "action": "Navigate to a work request checklist step without proper permissions",
        "expected_result": "Checklist step page loads but save operations should be restricted",
        "notes": ""
      },
      {
        "step_number": 2,
        "action": "Attempt to save checklist step changes",
        "expected_result": "Permission error message is displayed: 'You do not have permission to perform this action'",
        "notes": "Exact text depends on localization resources"
      }
    ],
    "automation_steps": [
      {
        "step_number": 1,
        "playwright_action": "navigate",
        "selector_key": "TODO_checklist_step_url",
        "value": "/Orders/OrderItem/View",
        "assertion_type": "visible",
        "assertion_value": ""
      },
      {
        "step_number": 2,
        "playwright_action": "click",
        "selector_key": "TODO_save_button",
        "value": "",
        "assertion_type": "contains",
        "assertion_value": "permission"
      }
    ],
    "test_data": {
      "workRequestId": "WR-001",
      "stepNumber": 1,
      "resultStatus": "PermissionError"
    },
    "confidence_score": 6,
    "needs_review": true,
    "review_note": "Cannot verify exact UI elements and error message text without localization resources and UI confirmation",
    "generated_from_file": "WebApp/Areas/Orders/Controllers/OrderItemController.cs",
    "generated_at": "2025-01-15T10:30:00Z"
  },
  {
    "test_case_id": "TC-TRK-0004",
    "title": "Verify successful checklist step save returns QuestionsSuccess true",
    "description": "Ensures that when checklist step save operation succeeds, the response contains QuestionsSuccess: true and proper success message.",
    "module": "Orders",
    "test_type": "functional",
    "priority": "critical",
    "preconditions": [
      "User is logged in",
      "User has CanSaveProposal permission",
      "User is on a checklist step page with questions"
    ],
    "manual_steps": [
      {
        "step_number": 1,
        "action": "Navigate to a work request checklist step page",
        "expected_result": "Checklist step form loads with all questions visible",
        "notes": ""
      },
      {
        "step_number": 2,
        "action": "Fill all required question fields with valid data and click Save",
        "expected_result": "Success message is displayed and form indicates save was successful",
        "notes": "Response body should contain QuestionsSuccess: true"
      }
    ],
    "automation_steps": [
      {
        "step_number": 1,
        "playwright_action": "navigate",
        "selector_key": "TODO_checklist_step_url",
        "value": "/Orders/OrderItem/View",
        "assertion_type": "visible",
        "assertion_value": ""
      },
      {
        "step_number": 2,
        "playwright_action": "click",
        "selector_key": "TODO_save_button",
        "value": "",
        "assertion_type": "contains",
        "assertion_value": "true"
      }
    ],
    "test_data": {
      "workRequestId": "WR-001",
      "stepNumber": 1,
      "questionAnswers": {
        "question1": "Yes",
        "question2": "No"
      }
    },
    "confidence_score": 7,
    "needs_review": true,
    "review_note": "Button selector and exact success message validation need UI verification",
    "generated_from_file": "WebApp/Areas/Orders/Controllers/OrderItemController.cs",
    "generated_at": "2025-01-15T10:30:00Z"
  },
  {
    "test_case_id": "TC-TRK-0005",
    "title": "Verify checklist step save validates user permissions before processing",
    "description": "Ensures that the Save method checks user permissions before attempting to save checklist step data.",
    "module": "Orders",
    "test_type": "security",
    "priority": "critical",
    "preconditions": [
      "User is logged in",
      "User does not have CanSaveProposal permission",
      "Checklist step exists for testing"
    ],
    "manual_steps": [
      {
        "step_number": 1,
        "action": "Navigate to a checklist step page as a user without save permissions",
        "expected_result": "Page loads but save functionality should be disabled or restricted",
        "notes": ""
      },
      {
        "step_number": 2,
        "action": "Attempt to save checklist step data",
        "expected_result": "Permission denied error is returned, save operation is blocked",
        "notes": "System should check CanSaveProposal permission"
      }
    ],
    "automation_steps": [
      {
        "step_number": 1,
        "playwright_action": "navigate",
        "selector_key": "TODO_checklist_step_url",
        "value": "/Orders/OrderItem/Save",
        "assertion_type": "visible",
        "assertion_value": ""
      },
      {
        "step_number": 2,
        "playwright_action": "click",
        "selector_key": "TODO_save_button",
        "value": "",
        "assertion_type": "contains",
        "assertion_value": "permission"
      }
    ],
    "test_data": {
      "userId": "limited_user",
      "permissions": [
        "Proposal_View"
      ],
      "workRequestId": "WR-001"
    },
    "confidence_score": 8,
    "needs_review": false,
    "review_note": "",
    "generated_from_file": "WebApp/Areas/Orders/Controllers/OrderItemController.cs",
    "generated_at": "2025-01-15T10:30:00Z"
  },
  {
    "test_case_id": "TC-TRK-0006",
    "title": "Verify checklist step save handles missing or invalid step data gracefully",
    "description": "Ensures that the Save method properly validates step data and returns appropriate error messages for invalid or missing step information.",
    "module": "Orders",
    "test_type": "negative",
    "priority": "high",
    "preconditions": [
      "User is logged in",
      "User has CanSaveProposal permission"
    ],
    "manual_steps": [
      {
        "step_number": 1,
        "action": "Navigate to checklist step save endpoint with missing step data",
        "expected_result": "System should handle missing data gracefully without system error",
        "notes": ""
      },
      {
        "step_number": 2,
        "action": "Submit save request with invalid step information",
        "expected_result": "Validation error message is returned indicating invalid step data",
        "notes": "Should not cause system crash or unhandled exception"
      }
    ],
    "automation_steps": [
      {
        "step_number": 1,
        "playwright_action": "navigate",
        "selector_key": "TODO_checklist_step_save_url",
        "value": "/Orders/OrderItem/Save",
        "assertion_type": "visible",
        "assertion_value": ""
      },
      {
        "step_number": 2,
        "playwright_action": "click",
        "selector_key": "TODO_submit_button",
        "value": "",
        "assertion_type": "contains",
        "assertion_value": "invalid"
      }
    ],
    "test_data": {
      "stepData": null,
      "workRequestId": "INVALID-ID"
    },
    "confidence_score": 6,
    "needs_review": true,
    "review_note": "Cannot verify exact validation logic and error handling without seeing complete method implementation",
    "generated_from_file": "WebApp/Areas/Orders/Controllers/OrderItemController.cs",
    "generated_at": "2025-01-15T10:30:00Z"
  }
]